19:02:38.707672 IP localhost.57551 > localhost.cbt: UDP, length 1048
19:02:38.707910 IP localhost.57551 > localhost.cbt: UDP, length 1048
19:02:38.707927 IP localhost.57551 > localhost.cbt: UDP, length 1048
19:02:38.708321 IP localhost.57551 > localhost.cbt: UDP, length 1048
19:02:38.708397 IP localhost.57551 > localhost.cbt: UDP, length 1048
19:02:38.708412 IP localhost.57551 > localhost.cbt: UDP, length 1048
19:02:38.708423 IP localhost.57551 > localhost.cbt: UDP, length 1048
19:02:38.708451 IP localhost.57551 > localhost.cbt: UDP, length 1048
19:02:38.708469 IP localhost.57551 > localhost.cbt: UDP, length 1048
19:02:38.708483 IP localhost.57551 > localhost.cbt: UDP, length 1048
19:02:38.708497 IP localhost.57551 > localhost.cbt: UDP, length 1048
19:02:38.708511 IP localhost.57551 > localhost.cbt: UDP, length 1048
19:02:38.708537 IP localhost.57551 > localhost.cbt: UDP, length 1048
19:02:38.708551 IP localhost.57551 > localhost.cbt: UDP, length 1048
19:02:38.708567 IP localhost.57551 > localhost.cbt: UDP, length 1048
19:02:38.708584 IP localhost.57551 > localhost.cbt: UDP, length 1048
19:02:38.708605 IP localhost.57551 > localhost.cbt: UDP, length 1048
19:02:38.708620 IP localhost.57551 > localhost.cbt: UDP, length 1048
19:02:38.708639 IP localhost.57551 > localhost.cbt: UDP, length 1048
19:02:38.708652 IP localhost.57551 > localhost.cbt: UDP, length 1048
19:02:38.708668 IP localhost.57551 > localhost.cbt: UDP, length 1048
19:02:38.708685 IP localhost.57551 > localhost.cbt: UDP, length 1048
19:02:38.708702 IP localhost.57551 > localhost.cbt: UDP, length 1048
19:02:38.777129 IP localhost.57551 > localhost.cbt: UDP, length 1048
19:02:38.777139 IP localhost.57551 > localhost.cbt: UDP, length 1048
19:02:38.777155 IP localhost.57551 > localhost.cbt: UDP, length 1048
19:02:38.777162 IP localhost.57551 > localhost.cbt: UDP, length 1048
19:02:38.777169 IP localhost.57551 > localhost.cbt: UDP, length 1048
19:02:38.777177 IP localhost.57551 > localhost.cbt: UDP, length 1048
19:02:38.777185 IP localhost.57551 > localhost.cbt: UDP, length 1048
19:02:38.777195 IP localhost.57551 > localhost.cbt: UDP, length 1048
19:02:38.777202 IP localhost.57551 > localhost.cbt: UDP, length 1048
19:02:38.777209 IP localhost.57551 > localhost.cbt: UDP, length 1048
19:02:38.777216 IP localhost.57551 > localhost.cbt: UDP, length 1048
19:02:38.777225 IP localhost.57551 > localhost.cbt: UDP, length 1048
19:02:38.777233 IP localhost.57551 > localhost.cbt: UDP, length 1048
19:02:38.832378 IP localhost.57551 > localhost.cbt: UDP, length 1048
19:02:38.832388 IP localhost.57551 > localhost.cbt: UDP, length 1048
19:02:38.832394 IP localhost.57551 > localhost.cbt: UDP, length 1048
19:02:38.832401 IP localhost.57551 > localhost.cbt: UDP, length 1048
19:02:38.832408 IP localhost.57551 > localhost.cbt: UDP, length 1048
19:02:38.832415 IP localhost.57551 > localhost.cbt: UDP, length 1048
19:02:38.832422 IP localhost.57551 > localhost.cbt: UDP, length 1048
19:02:38.832430 IP localhost.57551 > localhost.cbt: UDP, length 1048
19:02:38.888065 IP localhost.57551 > localhost.cbt: UDP, length 1048
19:02:38.888094 IP localhost.57551 > localhost.cbt: UDP, length 1048
19:02:38.888104 IP localhost.57551 > localhost.cbt: UDP, length 1048
19:02:38.888123 IP localhost.57551 > localhost.cbt: UDP, length 1048
19:02:38.888144 IP localhost.57551 > localhost.cbt: UDP, length 1048
19:02:38.888154 IP localhost.57551 > localhost.cbt: UDP, length 1048
19:02:38.888161 IP localhost.57551 > localhost.cbt: UDP, length 1048
19:02:38.888174 IP localhost.57551 > localhost.cbt: UDP, length 1048
19:02:38.943525 IP localhost.57551 > localhost.cbt: UDP, length 1048
19:02:38.943537 IP localhost.57551 > localhost.cbt: UDP, length 1048
19:02:38.943543 IP localhost.57551 > localhost.cbt: UDP, length 1048
19:02:38.943570 IP localhost.57551 > localhost.cbt: UDP, length 1048
19:02:38.943581 IP localhost.57551 > localhost.cbt: UDP, length 1048
19:02:38.943588 IP localhost.57551 > localhost.cbt: UDP, length 1048
19:02:38.999730 IP localhost.57551 > localhost.cbt: UDP, length 1048
19:02:38.999742 IP localhost.57551 > localhost.cbt: UDP, length 1048
19:02:38.999749 IP localhost.57551 > localhost.cbt: UDP, length 1048
19:02:38.999756 IP localhost.57551 > localhost.cbt: UDP, length 1048
19:02:38.999763 IP localhost.57551 > localhost.cbt: UDP, length 1048
19:02:38.999774 IP localhost.57551 > localhost.cbt: UDP, length 1048
19:02:38.999794 IP localhost.57551 > localhost.cbt: UDP, length 1048
19:02:38.999803 IP localhost.57551 > localhost.cbt: UDP, length 1048
19:02:38.999813 IP localhost.57551 > localhost.cbt: UDP, length 1048
19:02:38.999824 IP localhost.57551 > localhost.cbt: UDP, length 1048
19:02:38.999833 IP localhost.57551 > localhost.cbt: UDP, length 1048
19:02:38.999843 IP localhost.57551 > localhost.cbt: UDP, length 1048
19:02:38.999853 IP localhost.57551 > localhost.cbt: UDP, length 1048
19:02:38.999892 IP localhost.57551 > localhost.cbt: UDP, length 1048
19:02:38.999907 IP localhost.57551 > localhost.cbt: UDP, length 1048
19:02:39.059087 IP localhost.57551 > localhost.cbt: UDP, length 1048
19:02:39.059098 IP localhost.57551 > localhost.cbt: UDP, length 1048
19:02:39.059111 IP localhost.57551 > localhost.cbt: UDP, length 1048
19:02:39.059131 IP localhost.57551 > localhost.cbt: UDP, length 1048
19:02:39.059138 IP localhost.57551 > localhost.cbt: UDP, length 1048
19:02:39.059144 IP localhost.57551 > localhost.cbt: UDP, length 1048
19:02:39.059151 IP localhost.57551 > localhost.cbt: UDP, length 1048
19:02:39.115940 IP localhost.57551 > localhost.cbt: UDP, length 1048
19:02:39.115972 IP localhost.57551 > localhost.cbt: UDP, length 1048
19:02:39.115980 IP localhost.57551 > localhost.cbt: UDP, length 1048
19:02:39.115987 IP localhost.57551 > localhost.cbt: UDP, length 1048
19:02:39.115993 IP localhost.57551 > localhost.cbt: UDP, length 1048
19:02:39.115999 IP localhost.57551 > localhost.cbt: UDP, length 1048
19:02:39.116006 IP localhost.57551 > localhost.cbt: UDP, length 1048
19:02:39.116012 IP localhost.57551 > localhost.cbt: UDP, length 1048
19:02:39.116020 IP localhost.57551 > localhost.cbt: UDP, length 1048
19:02:39.116029 IP localhost.57551 > localhost.cbt: UDP, length 1048
19:02:39.116036 IP localhost.57551 > localhost.cbt: UDP, length 1048
19:02:39.116064 IP localhost.57551 > localhost.cbt: UDP, length 1048
19:02:39.116075 IP localhost.57551 > localhost.cbt: UDP, length 1048
19:02:39.116082 IP localhost.57551 > localhost.cbt: UDP, length 1048
19:02:39.173225 IP localhost.57551 > localhost.cbt: UDP, length 1048
19:02:39.173235 IP localhost.57551 > localhost.cbt: UDP, length 1048
19:02:39.173241 IP localhost.57551 > localhost.cbt: UDP, length 1048
19:02:39.173299 IP localhost.57551 > localhost.cbt: UDP, length 1048
19:02:39.173320 IP localhost.57551 > localhost.cbt: UDP, length 1048
19:02:39.173328 IP localhost.57551 > localhost.cbt: UDP, length 1048
19:02:39.173334 IP localhost.57551 > localhost.cbt: UDP, length 1048
19:02:39.173341 IP localhost.57551 > localhost.cbt: UDP, length 1048
19:02:39.224375 IP localhost.57551 > localhost.cbt: UDP, length 1048
19:02:39.224406 IP localhost.57551 > localhost.cbt: UDP, length 1048
19:02:39.224426 IP localhost.57551 > localhost.cbt: UDP, length 1048
19:02:39.224441 IP localhost.57551 > localhost.cbt: UDP, length 1048
19:02:39.224587 IP localhost.57551 > localhost.cbt: UDP, length 1048
19:02:39.224607 IP localhost.57551 > localhost.cbt: UDP, length 1048
19:02:39.224615 IP localhost.57551 > localhost.cbt: UDP, length 1048
19:02:39.286978 IP localhost.57551 > localhost.cbt: UDP, length 1048
19:02:39.287002 IP localhost.57551 > localhost.cbt: UDP, length 1048
19:02:39.287012 IP localhost.57551 > localhost.cbt: UDP, length 1048
19:02:39.287022 IP localhost.57551 > localhost.cbt: UDP, length 1048
19:02:39.287029 IP localhost.57551 > localhost.cbt: UDP, length 1048
19:02:39.287035 IP localhost.57551 > localhost.cbt: UDP, length 1048
19:02:39.287041 IP localhost.57551 > localhost.cbt: UDP, length 1048
19:02:39.287050 IP localhost.57551 > localhost.cbt: UDP, length 1048
19:02:39.287056 IP localhost.57551 > localhost.cbt: UDP, length 1048
19:02:39.287062 IP localhost.57551 > localhost.cbt: UDP, length 1048
19:02:39.287068 IP localhost.57551 > localhost.cbt: UDP, length 1048
19:02:39.287075 IP localhost.57551 > localhost.cbt: UDP, length 1048
19:02:39.287088 IP localhost.57551 > localhost.cbt: UDP, length 1048
19:02:39.287095 IP localhost.57551 > localhost.cbt: UDP, length 1048
19:02:39.287102 IP localhost.57551 > localhost.cbt: UDP, length 1048
19:02:39.287107 IP localhost.57551 > localhost.cbt: UDP, length 1048
19:02:39.287112 IP localhost.57551 > localhost.cbt: UDP, length 1048
19:02:39.287117 IP localhost.57551 > localhost.cbt: UDP, length 1048
19:02:39.287124 IP localhost.57551 > localhost.cbt: UDP, length 1048
19:02:39.287134 IP localhost.57551 > localhost.cbt: UDP, length 1048
19:02:39.287157 IP localhost.57551 > localhost.cbt: UDP, length 1048
19:02:39.287167 IP localhost.57551 > localhost.cbt: UDP, length 1048
19:02:39.287174 IP localhost.57551 > localhost.cbt: UDP, length 1048
19:02:39.287181 IP localhost.57551 > localhost.cbt: UDP, length 1048
19:02:39.339814 IP localhost.57551 > localhost.cbt: UDP, length 1048
19:02:39.339841 IP localhost.57551 > localhost.cbt: UDP, length 1048
19:02:39.339868 IP localhost.57551 > localhost.cbt: UDP, length 1048
19:02:39.339893 IP localhost.57551 > localhost.cbt: UDP, length 1048
19:02:39.339907 IP localhost.57551 > localhost.cbt: UDP, length 1048
19:02:39.339921 IP localhost.57551 > localhost.cbt: UDP, length 1048
19:02:39.339934 IP localhost.57551 > localhost.cbt: UDP, length 1048
19:02:39.339947 IP localhost.57551 > localhost.cbt: UDP, length 1048
19:02:39.339965 IP localhost.57551 > localhost.cbt: UDP, length 1048
19:02:39.339981 IP localhost.57551 > localhost.cbt: UDP, length 1048
19:02:39.339994 IP localhost.57551 > localhost.cbt: UDP, length 1048
19:02:39.340016 IP localhost.57551 > localhost.cbt: UDP, length 1048
19:02:39.394620 IP localhost.57551 > localhost.cbt: UDP, length 1048
19:02:39.394627 IP localhost.57551 > localhost.cbt: UDP, length 1048
19:02:39.394632 IP localhost.57551 > localhost.cbt: UDP, length 1048
19:02:39.394635 IP localhost.57551 > localhost.cbt: UDP, length 1048
19:02:39.394640 IP localhost.57551 > localhost.cbt: UDP, length 1048
19:02:39.394643 IP localhost.57551 > localhost.cbt: UDP, length 1048
19:02:39.394647 IP localhost.57551 > localhost.cbt: UDP, length 1048
19:02:39.394653 IP localhost.57551 > localhost.cbt: UDP, length 1048
19:02:39.394657 IP localhost.57551 > localhost.cbt: UDP, length 1048
19:02:39.394660 IP localhost.57551 > localhost.cbt: UDP, length 1048
19:02:39.394664 IP localhost.57551 > localhost.cbt: UDP, length 1048
19:02:39.394668 IP localhost.57551 > localhost.cbt: UDP, length 1048
19:02:39.450769 IP localhost.57551 > localhost.cbt: UDP, length 1048
19:02:39.450798 IP localhost.57551 > localhost.cbt: UDP, length 1048
19:02:39.450804 IP localhost.57551 > localhost.cbt: UDP, length 1048
19:02:39.450810 IP localhost.57551 > localhost.cbt: UDP, length 1048
19:02:39.450816 IP localhost.57551 > localhost.cbt: UDP, length 1048
19:02:39.450822 IP localhost.57551 > localhost.cbt: UDP, length 1048
19:02:39.450829 IP localhost.57551 > localhost.cbt: UDP, length 1048
19:02:39.450836 IP localhost.57551 > localhost.cbt: UDP, length 1048
19:02:39.508637 IP localhost.57551 > localhost.cbt: UDP, length 1048
19:02:39.508648 IP localhost.57551 > localhost.cbt: UDP, length 1048
19:02:39.508654 IP localhost.57551 > localhost.cbt: UDP, length 1048
19:02:39.508661 IP localhost.57551 > localhost.cbt: UDP, length 1048
19:02:39.508668 IP localhost.57551 > localhost.cbt: UDP, length 1048
19:02:39.508675 IP localhost.57551 > localhost.cbt: UDP, length 1048
19:02:39.508681 IP localhost.57551 > localhost.cbt: UDP, length 1048
19:02:39.564723 IP localhost.57551 > localhost.cbt: UDP, length 1048
19:02:39.564773 IP localhost.57551 > localhost.cbt: UDP, length 1048
19:02:39.564784 IP localhost.57551 > localhost.cbt: UDP, length 1048
19:02:39.564791 IP localhost.57551 > localhost.cbt: UDP, length 1048
19:02:39.564798 IP localhost.57551 > localhost.cbt: UDP, length 1048
19:02:39.564805 IP localhost.57551 > localhost.cbt: UDP, length 1048
19:02:39.564820 IP localhost.57551 > localhost.cbt: UDP, length 1048
19:02:39.564827 IP localhost.57551 > localhost.cbt: UDP, length 1048
19:02:39.564834 IP localhost.57551 > localhost.cbt: UDP, length 1048
19:02:39.564841 IP localhost.57551 > localhost.cbt: UDP, length 1048
19:02:39.564848 IP localhost.57551 > localhost.cbt: UDP, length 1048
19:02:39.564858 IP localhost.57551 > localhost.cbt: UDP, length 1048
19:02:39.619861 IP localhost.57551 > localhost.cbt: UDP, length 1048
19:02:39.619873 IP localhost.57551 > localhost.cbt: UDP, length 1048
19:02:39.619879 IP localhost.57551 > localhost.cbt: UDP, length 1048
19:02:39.619886 IP localhost.57551 > localhost.cbt: UDP, length 1048
19:02:39.619892 IP localhost.57551 > localhost.cbt: UDP, length 1048
19:02:39.619899 IP localhost.57551 > localhost.cbt: UDP, length 1048
19:02:39.619906 IP localhost.57551 > localhost.cbt: UDP, length 1048
19:02:39.619917 IP localhost.57551 > localhost.cbt: UDP, length 1048
19:02:39.619925 IP localhost.57551 > localhost.cbt: UDP, length 1048
19:02:39.619932 IP localhost.57551 > localhost.cbt: UDP, length 1048
19:02:39.619942 IP localhost.57551 > localhost.cbt: UDP, length 1048
19:02:39.681369 IP localhost.57551 > localhost.cbt: UDP, length 1048
19:02:39.681382 IP localhost.57551 > localhost.cbt: UDP, length 1048
19:02:39.681389 IP localhost.57551 > localhost.cbt: UDP, length 1048
19:02:39.681396 IP localhost.57551 > localhost.cbt: UDP, length 1048
19:02:39.681404 IP localhost.57551 > localhost.cbt: UDP, length 1048
19:02:39.681412 IP localhost.57551 > localhost.cbt: UDP, length 1048
19:02:39.681420 IP localhost.57551 > localhost.cbt: UDP, length 1048
19:02:39.681427 IP localhost.57551 > localhost.cbt: UDP, length 1048
19:02:39.681444 IP localhost.57551 > localhost.cbt: UDP, length 1048
19:02:39.681455 IP localhost.57551 > localhost.cbt: UDP, length 1048
19:02:39.681463 IP localhost.57551 > localhost.cbt: UDP, length 1048
19:02:39.681471 IP localhost.57551 > localhost.cbt: UDP, length 1048
19:02:39.735956 IP localhost.57551 > localhost.cbt: UDP, length 1048
19:02:39.735990 IP localhost.57551 > localhost.cbt: UDP, length 1048
19:02:39.736001 IP localhost.57551 > localhost.cbt: UDP, length 1048
19:02:39.736008 IP localhost.57551 > localhost.cbt: UDP, length 1048
19:02:39.736021 IP localhost.57551 > localhost.cbt: UDP, length 1048
19:02:39.736028 IP localhost.57551 > localhost.cbt: UDP, length 1048
19:02:39.736035 IP localhost.57551 > localhost.cbt: UDP, length 1048
19:02:39.736043 IP localhost.57551 > localhost.cbt: UDP, length 1048
19:02:39.736055 IP localhost.57551 > localhost.cbt: UDP, length 1048
19:02:39.736062 IP localhost.57551 > localhost.cbt: UDP, length 1048
19:02:39.736069 IP localhost.57551 > localhost.cbt: UDP, length 1048
19:02:39.736076 IP localhost.57551 > localhost.cbt: UDP, length 1048
19:02:39.788071 IP localhost.57551 > localhost.cbt: UDP, length 1048
19:02:39.788082 IP localhost.57551 > localhost.cbt: UDP, length 1048
19:02:39.788095 IP localhost.57551 > localhost.cbt: UDP, length 1048
19:02:39.788102 IP localhost.57551 > localhost.cbt: UDP, length 1048
19:02:39.788109 IP localhost.57551 > localhost.cbt: UDP, length 1048
19:02:39.788115 IP localhost.57551 > localhost.cbt: UDP, length 1048
19:02:39.788122 IP localhost.57551 > localhost.cbt: UDP, length 1048
19:02:39.788128 IP localhost.57551 > localhost.cbt: UDP, length 1048
19:02:39.788135 IP localhost.57551 > localhost.cbt: UDP, length 1048
19:02:39.788141 IP localhost.57551 > localhost.cbt: UDP, length 1048
19:02:39.788151 IP localhost.57551 > localhost.cbt: UDP, length 1048
19:02:39.788157 IP localhost.57551 > localhost.cbt: UDP, length 1048
19:02:39.788164 IP localhost.57551 > localhost.cbt: UDP, length 1048
19:02:39.788170 IP localhost.57551 > localhost.cbt: UDP, length 1048
19:02:39.788178 IP localhost.57551 > localhost.cbt: UDP, length 1048
19:02:39.788184 IP localhost.57551 > localhost.cbt: UDP, length 1048
19:02:39.788193 IP localhost.57551 > localhost.cbt: UDP, length 1048
19:02:39.788201 IP localhost.57551 > localhost.cbt: UDP, length 1048
19:02:39.788208 IP localhost.57551 > localhost.cbt: UDP, length 1048
19:02:39.788214 IP localhost.57551 > localhost.cbt: UDP, length 1048
19:02:39.788220 IP localhost.57551 > localhost.cbt: UDP, length 1048
19:02:39.788227 IP localhost.57551 > localhost.cbt: UDP, length 1048
19:02:39.788234 IP localhost.57551 > localhost.cbt: UDP, length 1048
19:02:39.788240 IP localhost.57551 > localhost.cbt: UDP, length 1048
19:02:39.788246 IP localhost.57551 > localhost.cbt: UDP, length 1048
19:02:39.788255 IP localhost.57551 > localhost.cbt: UDP, length 1048
19:02:39.788262 IP localhost.57551 > localhost.cbt: UDP, length 1048
19:02:39.844954 IP localhost.57551 > localhost.cbt: UDP, length 1048
19:02:39.844965 IP localhost.57551 > localhost.cbt: UDP, length 1048
19:02:39.844972 IP localhost.57551 > localhost.cbt: UDP, length 1048
19:02:39.844978 IP localhost.57551 > localhost.cbt: UDP, length 1048
19:02:39.844991 IP localhost.57551 > localhost.cbt: UDP, length 1048
19:02:39.845000 IP localhost.57551 > localhost.cbt: UDP, length 1048
19:02:39.845006 IP localhost.57551 > localhost.cbt: UDP, length 1048
19:02:39.845012 IP localhost.57551 > localhost.cbt: UDP, length 1048
19:02:39.845019 IP localhost.57551 > localhost.cbt: UDP, length 1048
19:02:39.845033 IP localhost.57551 > localhost.cbt: UDP, length 1048
19:02:39.845061 IP localhost.57551 > localhost.cbt: UDP, length 1048
19:02:39.845068 IP localhost.57551 > localhost.cbt: UDP, length 1048
19:02:39.901267 IP localhost.57551 > localhost.cbt: UDP, length 1048
19:02:39.901277 IP localhost.57551 > localhost.cbt: UDP, length 1048
19:02:39.901283 IP localhost.57551 > localhost.cbt: UDP, length 1048
19:02:39.901289 IP localhost.57551 > localhost.cbt: UDP, length 1048
19:02:39.901296 IP localhost.57551 > localhost.cbt: UDP, length 1048
19:02:39.901304 IP localhost.57551 > localhost.cbt: UDP, length 1048
19:02:39.901310 IP localhost.57551 > localhost.cbt: UDP, length 1048
19:02:39.956107 IP localhost.57551 > localhost.cbt: UDP, length 1048
19:02:39.956117 IP localhost.57551 > localhost.cbt: UDP, length 1048
19:02:39.956124 IP localhost.57551 > localhost.cbt: UDP, length 1048
19:02:39.956131 IP localhost.57551 > localhost.cbt: UDP, length 1048
19:02:39.956138 IP localhost.57551 > localhost.cbt: UDP, length 1048
19:02:39.956145 IP localhost.57551 > localhost.cbt: UDP, length 1048
19:02:39.956152 IP localhost.57551 > localhost.cbt: UDP, length 1048
19:02:39.956159 IP localhost.57551 > localhost.cbt: UDP, length 1048
19:02:39.956166 IP localhost.57551 > localhost.cbt: UDP, length 1048
19:02:39.956173 IP localhost.57551 > localhost.cbt: UDP, length 1048
19:02:39.956180 IP localhost.57551 > localhost.cbt: UDP, length 1048
19:02:39.956188 IP localhost.57551 > localhost.cbt: UDP, length 1048
19:02:40.014557 IP localhost.57551 > localhost.cbt: UDP, length 1048
19:02:40.014652 IP localhost.57551 > localhost.cbt: UDP, length 1048
19:02:40.014661 IP localhost.57551 > localhost.cbt: UDP, length 1048
19:02:40.014668 IP localhost.57551 > localhost.cbt: UDP, length 1048
19:02:40.014674 IP localhost.57551 > localhost.cbt: UDP, length 1048
19:02:40.075408 IP localhost.57551 > localhost.cbt: UDP, length 1048
19:02:40.075423 IP localhost.57551 > localhost.cbt: UDP, length 1048
19:02:40.075429 IP localhost.57551 > localhost.cbt: UDP, length 1048
19:02:40.075436 IP localhost.57551 > localhost.cbt: UDP, length 1048
19:02:40.075443 IP localhost.57551 > localhost.cbt: UDP, length 1048
19:02:40.075458 IP localhost.57551 > localhost.cbt: UDP, length 1048
19:02:40.137105 IP localhost.57551 > localhost.cbt: UDP, length 1048
19:02:40.137115 IP localhost.57551 > localhost.cbt: UDP, length 1048
19:02:40.137120 IP localhost.57551 > localhost.cbt: UDP, length 1048
19:02:40.187820 IP localhost.57551 > localhost.cbt: UDP, length 1048
19:02:40.187857 IP localhost.57551 > localhost.cbt: UDP, length 1048
19:02:40.187869 IP localhost.57551 > localhost.cbt: UDP, length 1048
19:02:40.187876 IP localhost.57551 > localhost.cbt: UDP, length 1048
19:02:40.187883 IP localhost.57551 > localhost.cbt: UDP, length 1048
19:02:40.187890 IP localhost.57551 > localhost.cbt: UDP, length 1048
19:02:40.187896 IP localhost.57551 > localhost.cbt: UDP, length 1048
19:02:40.187903 IP localhost.57551 > localhost.cbt: UDP, length 1048
19:02:40.187911 IP localhost.57551 > localhost.cbt: UDP, length 1048
19:02:40.243772 IP localhost.57551 > localhost.cbt: UDP, length 1048
19:02:40.243783 IP localhost.57551 > localhost.cbt: UDP, length 1048
19:02:40.243790 IP localhost.57551 > localhost.cbt: UDP, length 1048
19:02:40.293653 IP localhost.57551 > localhost.cbt: UDP, length 1048
19:02:40.293669 IP localhost.57551 > localhost.cbt: UDP, length 1048
19:02:40.293676 IP localhost.57551 > localhost.cbt: UDP, length 1048
19:02:40.293683 IP localhost.57551 > localhost.cbt: UDP, length 1048
19:02:40.293693 IP localhost.57551 > localhost.cbt: UDP, length 1048
19:02:40.293701 IP localhost.57551 > localhost.cbt: UDP, length 1048
19:02:40.345896 IP localhost.57551 > localhost.cbt: UDP, length 1048
19:02:40.345906 IP localhost.57551 > localhost.cbt: UDP, length 1048
19:02:40.345912 IP localhost.57551 > localhost.cbt: UDP, length 1048
19:02:40.345918 IP localhost.57551 > localhost.cbt: UDP, length 1048
19:02:40.345928 IP localhost.57551 > localhost.cbt: UDP, length 1048
19:02:40.345934 IP localhost.57551 > localhost.cbt: UDP, length 1048
19:02:40.345940 IP localhost.57551 > localhost.cbt: UDP, length 1048
19:02:40.345946 IP localhost.57551 > localhost.cbt: UDP, length 1048
19:02:40.345952 IP localhost.57551 > localhost.cbt: UDP, length 1048
19:02:40.345962 IP localhost.57551 > localhost.cbt: UDP, length 1048
19:02:40.345968 IP localhost.57551 > localhost.cbt: UDP, length 1048
19:02:40.345974 IP localhost.57551 > localhost.cbt: UDP, length 1048
19:02:40.345980 IP localhost.57551 > localhost.cbt: UDP, length 1048
19:02:40.345989 IP localhost.57551 > localhost.cbt: UDP, length 1048
19:02:40.345995 IP localhost.57551 > localhost.cbt: UDP, length 1048
19:02:40.346002 IP localhost.57551 > localhost.cbt: UDP, length 1048
19:02:40.346008 IP localhost.57551 > localhost.cbt: UDP, length 1048
19:02:40.346015 IP localhost.57551 > localhost.cbt: UDP, length 1048
19:02:40.346021 IP localhost.57551 > localhost.cbt: UDP, length 1048
19:02:40.346028 IP localhost.57551 > localhost.cbt: UDP, length 1048
19:02:40.346034 IP localhost.57551 > localhost.cbt: UDP, length 1048
19:02:40.346040 IP localhost.57551 > localhost.cbt: UDP, length 1048
19:02:40.346050 IP localhost.57551 > localhost.cbt: UDP, length 1048
19:02:40.346164 IP localhost.57551 > localhost.cbt: UDP, length 1048
19:02:40.346173 IP localhost.57551 > localhost.cbt: UDP, length 1048
19:02:40.346179 IP localhost.57551 > localhost.cbt: UDP, length 1048
19:02:40.346185 IP localhost.57551 > localhost.cbt: UDP, length 1048
19:02:40.404948 IP localhost.57551 > localhost.cbt: UDP, length 1048
19:02:40.404959 IP localhost.57551 > localhost.cbt: UDP, length 1048
19:02:40.404969 IP localhost.57551 > localhost.cbt: UDP, length 1048
19:02:40.404975 IP localhost.57551 > localhost.cbt: UDP, length 1048
19:02:40.404981 IP localhost.57551 > localhost.cbt: UDP, length 1048
19:02:40.404987 IP localhost.57551 > localhost.cbt: UDP, length 1048
19:02:40.404994 IP localhost.57551 > localhost.cbt: UDP, length 1048
19:02:40.459790 IP localhost.57551 > localhost.cbt: UDP, length 1048
19:02:40.459803 IP localhost.57551 > localhost.cbt: UDP, length 1048
19:02:40.459809 IP localhost.57551 > localhost.cbt: UDP, length 1048
19:02:40.459815 IP localhost.57551 > localhost.cbt: UDP, length 1048
19:02:40.459822 IP localhost.57551 > localhost.cbt: UDP, length 1048
19:02:40.518021 IP localhost.57551 > localhost.cbt: UDP, length 1048
19:02:40.518053 IP localhost.57551 > localhost.cbt: UDP, length 1048
19:02:40.518061 IP localhost.57551 > localhost.cbt: UDP, length 1048
19:02:40.518073 IP localhost.57551 > localhost.cbt: UDP, length 1048
19:02:40.518080 IP localhost.57551 > localhost.cbt: UDP, length 1048
19:02:40.518087 IP localhost.57551 > localhost.cbt: UDP, length 1048
19:02:40.518094 IP localhost.57551 > localhost.cbt: UDP, length 1048
19:02:40.518104 IP localhost.57551 > localhost.cbt: UDP, length 1048
19:02:40.518112 IP localhost.57551 > localhost.cbt: UDP, length 1048
19:02:40.518119 IP localhost.57551 > localhost.cbt: UDP, length 1048
19:02:40.574199 IP localhost.57551 > localhost.cbt: UDP, length 1048
19:02:40.574215 IP localhost.57551 > localhost.cbt: UDP, length 1048
19:02:40.574221 IP localhost.57551 > localhost.cbt: UDP, length 1048
19:02:40.574227 IP localhost.57551 > localhost.cbt: UDP, length 1048
19:02:40.629986 IP localhost.57551 > localhost.cbt: UDP, length 1048
19:02:40.629998 IP localhost.57551 > localhost.cbt: UDP, length 1048
19:02:40.630004 IP localhost.57551 > localhost.cbt: UDP, length 1048
19:02:40.630011 IP localhost.57551 > localhost.cbt: UDP, length 1048
19:02:40.630017 IP localhost.57551 > localhost.cbt: UDP, length 1048
19:02:40.686970 IP localhost.57551 > localhost.cbt: UDP, length 1048
19:02:40.686982 IP localhost.57551 > localhost.cbt: UDP, length 1048
19:02:40.686988 IP localhost.57551 > localhost.cbt: UDP, length 1048
19:02:40.686995 IP localhost.57551 > localhost.cbt: UDP, length 1048
19:02:40.687000 IP localhost.57551 > localhost.cbt: UDP, length 1048
19:02:40.739983 IP localhost.57551 > localhost.cbt: UDP, length 1048
19:02:40.740008 IP localhost.57551 > localhost.cbt: UDP, length 1048
19:02:40.740015 IP localhost.57551 > localhost.cbt: UDP, length 1048
19:02:40.740021 IP localhost.57551 > localhost.cbt: UDP, length 1048
19:02:40.740026 IP localhost.57551 > localhost.cbt: UDP, length 1048
19:02:40.740037 IP localhost.57551 > localhost.cbt: UDP, length 1048
19:02:40.740044 IP localhost.57551 > localhost.cbt: UDP, length 1048
19:02:40.740050 IP localhost.57551 > localhost.cbt: UDP, length 1048
19:02:40.802910 IP localhost.57551 > localhost.cbt: UDP, length 1048
19:02:40.802923 IP localhost.57551 > localhost.cbt: UDP, length 1048
19:02:40.802930 IP localhost.57551 > localhost.cbt: UDP, length 1048
19:02:40.802947 IP localhost.57551 > localhost.cbt: UDP, length 1048
19:02:40.802955 IP localhost.57551 > localhost.cbt: UDP, length 1048
19:02:40.802961 IP localhost.57551 > localhost.cbt: UDP, length 1048
19:02:40.802967 IP localhost.57551 > localhost.cbt: UDP, length 1048
19:02:40.802977 IP localhost.57551 > localhost.cbt: UDP, length 1048
19:02:40.858353 IP localhost.57551 > localhost.cbt: UDP, length 1048
19:02:40.858380 IP localhost.57551 > localhost.cbt: UDP, length 1048
19:02:40.858405 IP localhost.57551 > localhost.cbt: UDP, length 1048
19:02:40.858426 IP localhost.57551 > localhost.cbt: UDP, length 1048
19:02:40.858436 IP localhost.57551 > localhost.cbt: UDP, length 1048
19:02:40.858452 IP localhost.57551 > localhost.cbt: UDP, length 1048
19:02:40.909723 IP localhost.57551 > localhost.cbt: UDP, length 1048
19:02:40.909752 IP localhost.57551 > localhost.cbt: UDP, length 1048
19:02:40.909766 IP localhost.57551 > localhost.cbt: UDP, length 1048
19:02:40.909774 IP localhost.57551 > localhost.cbt: UDP, length 1048
19:02:40.909781 IP localhost.57551 > localhost.cbt: UDP, length 1048
19:02:40.909787 IP localhost.57551 > localhost.cbt: UDP, length 1048
19:02:40.909794 IP localhost.57551 > localhost.cbt: UDP, length 1048
19:02:40.909801 IP localhost.57551 > localhost.cbt: UDP, length 1048
19:02:40.909808 IP localhost.57551 > localhost.cbt: UDP, length 1048
19:02:40.909816 IP localhost.57551 > localhost.cbt: UDP, length 1048
19:02:40.909822 IP localhost.57551 > localhost.cbt: UDP, length 1048
19:02:40.909829 IP localhost.57551 > localhost.cbt: UDP, length 1048
19:02:40.909839 IP localhost.57551 > localhost.cbt: UDP, length 1048
19:02:40.909846 IP localhost.57551 > localhost.cbt: UDP, length 1048
19:02:40.909853 IP localhost.57551 > localhost.cbt: UDP, length 1048
19:02:40.909860 IP localhost.57551 > localhost.cbt: UDP, length 1048
19:02:40.909867 IP localhost.57551 > localhost.cbt: UDP, length 1048
19:02:40.909874 IP localhost.57551 > localhost.cbt: UDP, length 1048
19:02:40.909881 IP localhost.57551 > localhost.cbt: UDP, length 1048
19:02:40.909888 IP localhost.57551 > localhost.cbt: UDP, length 1048
19:02:40.909896 IP localhost.57551 > localhost.cbt: UDP, length 1048
19:02:40.968442 IP localhost.57551 > localhost.cbt: UDP, length 1048
19:02:40.968471 IP localhost.57551 > localhost.cbt: UDP, length 1048
19:02:40.968494 IP localhost.57551 > localhost.cbt: UDP, length 1048
19:02:40.968502 IP localhost.57551 > localhost.cbt: UDP, length 1048
19:02:40.968509 IP localhost.57551 > localhost.cbt: UDP, length 1048
19:02:40.968515 IP localhost.57551 > localhost.cbt: UDP, length 1048
19:02:40.968522 IP localhost.57551 > localhost.cbt: UDP, length 1048
19:02:40.968528 IP localhost.57551 > localhost.cbt: UDP, length 1048
19:02:40.968535 IP localhost.57551 > localhost.cbt: UDP, length 1048
19:02:40.968550 IP localhost.57551 > localhost.cbt: UDP, length 1048
19:02:40.968558 IP localhost.57551 > localhost.cbt: UDP, length 1048
19:02:41.034731 IP localhost.57551 > localhost.cbt: UDP, length 1048
19:02:41.034743 IP localhost.57551 > localhost.cbt: UDP, length 1048
19:02:41.034750 IP localhost.57551 > localhost.cbt: UDP, length 1048
19:02:41.034763 IP localhost.57551 > localhost.cbt: UDP, length 1048
19:02:41.034770 IP localhost.57551 > localhost.cbt: UDP, length 1048
19:02:41.034777 IP localhost.57551 > localhost.cbt: UDP, length 1048
19:02:41.034782 IP localhost.57551 > localhost.cbt: UDP, length 1048
19:02:41.034789 IP localhost.57551 > localhost.cbt: UDP, length 1048
19:02:41.034795 IP localhost.57551 > localhost.cbt: UDP, length 1048
19:02:41.034801 IP localhost.57551 > localhost.cbt: UDP, length 1048
19:02:41.034808 IP localhost.57551 > localhost.cbt: UDP, length 1048
19:02:41.034813 IP localhost.57551 > localhost.cbt: UDP, length 1048
19:02:41.034819 IP localhost.57551 > localhost.cbt: UDP, length 1048
19:02:41.103878 IP localhost.57551 > localhost.cbt: UDP, length 1048
19:02:41.103903 IP localhost.57551 > localhost.cbt: UDP, length 1048
19:02:41.103911 IP localhost.57551 > localhost.cbt: UDP, length 1048
19:02:41.103918 IP localhost.57551 > localhost.cbt: UDP, length 1048
19:02:41.103925 IP localhost.57551 > localhost.cbt: UDP, length 1048
19:02:41.103932 IP localhost.57551 > localhost.cbt: UDP, length 1048
19:02:41.103945 IP localhost.57551 > localhost.cbt: UDP, length 1048
19:02:41.103953 IP localhost.57551 > localhost.cbt: UDP, length 1048
19:02:41.103960 IP localhost.57551 > localhost.cbt: UDP, length 1048
19:02:41.103967 IP localhost.57551 > localhost.cbt: UDP, length 1048
19:02:41.161832 IP localhost.57551 > localhost.cbt: UDP, length 1048
19:02:41.161845 IP localhost.57551 > localhost.cbt: UDP, length 1048
19:02:41.161851 IP localhost.57551 > localhost.cbt: UDP, length 1048
19:02:41.161857 IP localhost.57551 > localhost.cbt: UDP, length 1048
19:02:41.219436 IP localhost.57551 > localhost.cbt: UDP, length 1048
19:02:41.219442 IP localhost.57551 > localhost.cbt: UDP, length 1048
19:02:41.219447 IP localhost.57551 > localhost.cbt: UDP, length 1048
19:02:41.219451 IP localhost.57551 > localhost.cbt: UDP, length 1048
19:02:41.219458 IP localhost.57551 > localhost.cbt: UDP, length 1048
19:02:41.219462 IP localhost.57551 > localhost.cbt: UDP, length 1048
19:02:41.219468 IP localhost.57551 > localhost.cbt: UDP, length 1048
19:02:41.281874 IP localhost.57551 > localhost.cbt: UDP, length 1048
19:02:41.281884 IP localhost.57551 > localhost.cbt: UDP, length 1048
19:02:41.281889 IP localhost.57551 > localhost.cbt: UDP, length 1048
19:02:41.281895 IP localhost.57551 > localhost.cbt: UDP, length 1048
19:02:41.281901 IP localhost.57551 > localhost.cbt: UDP, length 1048
19:02:41.281907 IP localhost.57551 > localhost.cbt: UDP, length 1048
19:02:41.281913 IP localhost.57551 > localhost.cbt: UDP, length 1048
19:02:41.281920 IP localhost.57551 > localhost.cbt: UDP, length 1048
19:02:41.281926 IP localhost.57551 > localhost.cbt: UDP, length 1048
19:02:41.281932 IP localhost.57551 > localhost.cbt: UDP, length 1048
19:02:41.281938 IP localhost.57551 > localhost.cbt: UDP, length 1048
19:02:41.340143 IP localhost.57551 > localhost.cbt: UDP, length 1048
19:02:41.340158 IP localhost.57551 > localhost.cbt: UDP, length 1048
19:02:41.340166 IP localhost.57551 > localhost.cbt: UDP, length 1048
19:02:41.340172 IP localhost.57551 > localhost.cbt: UDP, length 1048
19:02:41.340179 IP localhost.57551 > localhost.cbt: UDP, length 1048
19:02:41.404560 IP localhost.57551 > localhost.cbt: UDP, length 1048
19:02:41.404572 IP localhost.57551 > localhost.cbt: UDP, length 1048
19:02:41.404578 IP localhost.57551 > localhost.cbt: UDP, length 1048
19:02:41.404595 IP localhost.57551 > localhost.cbt: UDP, length 1048
19:02:41.404601 IP localhost.57551 > localhost.cbt: UDP, length 1048
19:02:41.404607 IP localhost.57551 > localhost.cbt: UDP, length 1048
19:02:41.404613 IP localhost.57551 > localhost.cbt: UDP, length 1048
19:02:41.404622 IP localhost.57551 > localhost.cbt: UDP, length 1048
19:02:41.404629 IP localhost.57551 > localhost.cbt: UDP, length 1048
19:02:41.404634 IP localhost.57551 > localhost.cbt: UDP, length 1048
19:02:41.458332 IP localhost.57551 > localhost.cbt: UDP, length 1048
19:02:41.458377 IP localhost.57551 > localhost.cbt: UDP, length 1048
19:02:41.458384 IP localhost.57551 > localhost.cbt: UDP, length 1048
19:02:41.458391 IP localhost.57551 > localhost.cbt: UDP, length 1048
19:02:41.458396 IP localhost.57551 > localhost.cbt: UDP, length 1048
19:02:41.516480 IP localhost.57551 > localhost.cbt: UDP, length 1048
19:02:41.516490 IP localhost.57551 > localhost.cbt: UDP, length 1048
19:02:41.516496 IP localhost.57551 > localhost.cbt: UDP, length 1048
19:02:41.516502 IP localhost.57551 > localhost.cbt: UDP, length 1048
19:02:41.516509 IP localhost.57551 > localhost.cbt: UDP, length 1048
19:02:41.516519 IP localhost.57551 > localhost.cbt: UDP, length 1048
19:02:41.516526 IP localhost.57551 > localhost.cbt: UDP, length 1048
19:02:41.516532 IP localhost.57551 > localhost.cbt: UDP, length 1048
19:02:41.516539 IP localhost.57551 > localhost.cbt: UDP, length 1048
19:02:41.516548 IP localhost.57551 > localhost.cbt: UDP, length 1048
19:02:41.516555 IP localhost.57551 > localhost.cbt: UDP, length 1048
19:02:41.516561 IP localhost.57551 > localhost.cbt: UDP, length 1048
19:02:41.516568 IP localhost.57551 > localhost.cbt: UDP, length 1048
19:02:41.516574 IP localhost.57551 > localhost.cbt: UDP, length 1048
19:02:41.516583 IP localhost.57551 > localhost.cbt: UDP, length 1048
19:02:41.516589 IP localhost.57551 > localhost.cbt: UDP, length 1048
19:02:41.516595 IP localhost.57551 > localhost.cbt: UDP, length 1048
19:02:41.516602 IP localhost.57551 > localhost.cbt: UDP, length 1048
19:02:41.516609 IP localhost.57551 > localhost.cbt: UDP, length 1048
19:02:41.516619 IP localhost.57551 > localhost.cbt: UDP, length 1048
19:02:41.516625 IP localhost.57551 > localhost.cbt: UDP, length 1048
19:02:41.516631 IP localhost.57551 > localhost.cbt: UDP, length 1048
19:02:41.570029 IP localhost.57551 > localhost.cbt: UDP, length 1048
19:02:41.570045 IP localhost.57551 > localhost.cbt: UDP, length 1048
19:02:41.570064 IP localhost.57551 > localhost.cbt: UDP, length 1048
19:02:41.570081 IP localhost.57551 > localhost.cbt: UDP, length 1048
19:02:41.570089 IP localhost.57551 > localhost.cbt: UDP, length 1048
19:02:41.570096 IP localhost.57551 > localhost.cbt: UDP, length 1048
19:02:41.570104 IP localhost.57551 > localhost.cbt: UDP, length 1048
19:02:41.622486 IP localhost.57551 > localhost.cbt: UDP, length 1048
19:02:41.622496 IP localhost.57551 > localhost.cbt: UDP, length 1048
19:02:41.622502 IP localhost.57551 > localhost.cbt: UDP, length 1048
19:02:41.622508 IP localhost.57551 > localhost.cbt: UDP, length 1048
19:02:41.622515 IP localhost.57551 > localhost.cbt: UDP, length 1048
19:02:41.622526 IP localhost.57551 > localhost.cbt: UDP, length 1048
19:02:41.622533 IP localhost.57551 > localhost.cbt: UDP, length 1048
19:02:41.622539 IP localhost.57551 > localhost.cbt: UDP, length 1048
19:02:41.679307 IP localhost.57551 > localhost.cbt: UDP, length 1048
19:02:41.679320 IP localhost.57551 > localhost.cbt: UDP, length 1048
19:02:41.679327 IP localhost.57551 > localhost.cbt: UDP, length 1048
19:02:41.679333 IP localhost.57551 > localhost.cbt: UDP, length 1048
19:02:41.679339 IP localhost.57551 > localhost.cbt: UDP, length 1048
19:02:41.679347 IP localhost.57551 > localhost.cbt: UDP, length 1048
19:02:41.679353 IP localhost.57551 > localhost.cbt: UDP, length 1048
19:02:41.679360 IP localhost.57551 > localhost.cbt: UDP, length 1048
19:02:41.679367 IP localhost.57551 > localhost.cbt: UDP, length 1048
19:02:41.679375 IP localhost.57551 > localhost.cbt: UDP, length 1048
19:02:41.679381 IP localhost.57551 > localhost.cbt: UDP, length 1048
19:02:41.679388 IP localhost.57551 > localhost.cbt: UDP, length 1048
19:02:41.736669 IP localhost.57551 > localhost.cbt: UDP, length 1048
19:02:41.736701 IP localhost.57551 > localhost.cbt: UDP, length 1048
19:02:41.736717 IP localhost.57551 > localhost.cbt: UDP, length 1048
19:02:41.736743 IP localhost.57551 > localhost.cbt: UDP, length 1048
19:02:41.736768 IP localhost.57551 > localhost.cbt: UDP, length 1048
19:02:41.736790 IP localhost.57551 > localhost.cbt: UDP, length 1048
19:02:41.736806 IP localhost.57551 > localhost.cbt: UDP, length 1048
19:02:41.736825 IP localhost.57551 > localhost.cbt: UDP, length 1048
19:02:41.736840 IP localhost.57551 > localhost.cbt: UDP, length 1048
19:02:41.736855 IP localhost.57551 > localhost.cbt: UDP, length 1048
19:02:41.736870 IP localhost.57551 > localhost.cbt: UDP, length 1048
19:02:41.796299 IP localhost.57551 > localhost.cbt: UDP, length 1048
19:02:41.796310 IP localhost.57551 > localhost.cbt: UDP, length 1048
19:02:41.796317 IP localhost.57551 > localhost.cbt: UDP, length 1048
19:02:41.796323 IP localhost.57551 > localhost.cbt: UDP, length 1048
19:02:41.796330 IP localhost.57551 > localhost.cbt: UDP, length 1048
19:02:41.796337 IP localhost.57551 > localhost.cbt: UDP, length 1048
19:02:41.796343 IP localhost.57551 > localhost.cbt: UDP, length 1048
19:02:41.796350 IP localhost.57551 > localhost.cbt: UDP, length 1048
19:02:41.796357 IP localhost.57551 > localhost.cbt: UDP, length 1048
19:02:41.796364 IP localhost.57551 > localhost.cbt: UDP, length 1048
19:02:41.796375 IP localhost.57551 > localhost.cbt: UDP, length 1048
19:02:41.796382 IP localhost.57551 > localhost.cbt: UDP, length 1048
19:02:41.796390 IP localhost.57551 > localhost.cbt: UDP, length 1048
19:02:41.796396 IP localhost.57551 > localhost.cbt: UDP, length 1048
19:02:41.796409 IP localhost.57551 > localhost.cbt: UDP, length 1048
19:02:41.796416 IP localhost.57551 > localhost.cbt: UDP, length 1048
19:02:41.796423 IP localhost.57551 > localhost.cbt: UDP, length 1048
19:02:41.796430 IP localhost.57551 > localhost.cbt: UDP, length 1048
19:02:41.796440 IP localhost.57551 > localhost.cbt: UDP, length 1048
19:02:41.796447 IP localhost.57551 > localhost.cbt: UDP, length 1048
19:02:41.796453 IP localhost.57551 > localhost.cbt: UDP, length 1048
19:02:41.796459 IP localhost.57551 > localhost.cbt: UDP, length 1048
19:02:41.796466 IP localhost.57551 > localhost.cbt: UDP, length 1048
19:02:41.796472 IP localhost.57551 > localhost.cbt: UDP, length 1048
19:02:41.851636 IP localhost.57551 > localhost.cbt: UDP, length 1048
19:02:41.851674 IP localhost.57551 > localhost.cbt: UDP, length 1048
19:02:41.851689 IP localhost.57551 > localhost.cbt: UDP, length 1048
19:02:41.851702 IP localhost.57551 > localhost.cbt: UDP, length 1048
19:02:41.851722 IP localhost.57551 > localhost.cbt: UDP, length 1048
19:02:41.906351 IP localhost.57551 > localhost.cbt: UDP, length 1048
19:02:41.906364 IP localhost.57551 > localhost.cbt: UDP, length 1048
19:02:41.906391 IP localhost.57551 > localhost.cbt: UDP, length 1048
19:02:41.906400 IP localhost.57551 > localhost.cbt: UDP, length 1048
19:02:41.906407 IP localhost.57551 > localhost.cbt: UDP, length 1048
19:02:41.906414 IP localhost.57551 > localhost.cbt: UDP, length 1048
19:02:41.906421 IP localhost.57551 > localhost.cbt: UDP, length 1048
19:02:41.906427 IP localhost.57551 > localhost.cbt: UDP, length 1048
19:02:41.906435 IP localhost.57551 > localhost.cbt: UDP, length 1048
19:02:41.906442 IP localhost.57551 > localhost.cbt: UDP, length 1048
19:02:41.962265 IP localhost.57551 > localhost.cbt: UDP, length 1048
19:02:41.962346 IP localhost.57551 > localhost.cbt: UDP, length 1048
19:02:41.962372 IP localhost.57551 > localhost.cbt: UDP, length 1048
19:02:41.962389 IP localhost.57551 > localhost.cbt: UDP, length 1048
19:02:41.962404 IP localhost.57551 > localhost.cbt: UDP, length 1048
19:02:42.027330 IP localhost.57551 > localhost.cbt: UDP, length 1048
19:02:42.027381 IP localhost.57551 > localhost.cbt: UDP, length 1048
19:02:42.027437 IP localhost.57551 > localhost.cbt: UDP, length 1048
19:02:42.027462 IP localhost.57551 > localhost.cbt: UDP, length 1048
19:02:42.027476 IP localhost.57551 > localhost.cbt: UDP, length 1048
19:02:42.097506 IP localhost.57551 > localhost.cbt: UDP, length 1048
19:02:42.097518 IP localhost.57551 > localhost.cbt: UDP, length 1048
19:02:42.097524 IP localhost.57551 > localhost.cbt: UDP, length 1048
19:02:42.097530 IP localhost.57551 > localhost.cbt: UDP, length 1048
19:02:42.097541 IP localhost.57551 > localhost.cbt: UDP, length 1048
19:02:42.097548 IP localhost.57551 > localhost.cbt: UDP, length 1048
19:02:42.097555 IP localhost.57551 > localhost.cbt: UDP, length 1048
19:02:42.097562 IP localhost.57551 > localhost.cbt: UDP, length 1048
19:02:42.097569 IP localhost.57551 > localhost.cbt: UDP, length 1048
19:02:42.097575 IP localhost.57551 > localhost.cbt: UDP, length 1048
19:02:42.097582 IP localhost.57551 > localhost.cbt: UDP, length 1048
19:02:42.097589 IP localhost.57551 > localhost.cbt: UDP, length 1048
19:02:42.097596 IP localhost.57551 > localhost.cbt: UDP, length 1048
19:02:42.097604 IP localhost.57551 > localhost.cbt: UDP, length 1048
19:02:42.097611 IP localhost.57551 > localhost.cbt: UDP, length 1048
19:02:42.097619 IP localhost.57551 > localhost.cbt: UDP, length 1048
19:02:42.150604 IP localhost.57551 > localhost.cbt: UDP, length 1048
19:02:42.150638 IP localhost.57551 > localhost.cbt: UDP, length 1048
19:02:42.150648 IP localhost.57551 > localhost.cbt: UDP, length 1048
19:02:42.150661 IP localhost.57551 > localhost.cbt: UDP, length 1048
19:02:42.150668 IP localhost.57551 > localhost.cbt: UDP, length 1048
19:02:42.150676 IP localhost.57551 > localhost.cbt: UDP, length 1048
19:02:42.150683 IP localhost.57551 > localhost.cbt: UDP, length 1048
19:02:42.150690 IP localhost.57551 > localhost.cbt: UDP, length 1048
19:02:42.150699 IP localhost.57551 > localhost.cbt: UDP, length 1048
19:02:42.150705 IP localhost.57551 > localhost.cbt: UDP, length 1048
19:02:42.150712 IP localhost.57551 > localhost.cbt: UDP, length 1048
19:02:42.150719 IP localhost.57551 > localhost.cbt: UDP, length 1048
19:02:42.150725 IP localhost.57551 > localhost.cbt: UDP, length 1048
19:02:42.150732 IP localhost.57551 > localhost.cbt: UDP, length 1048
19:02:42.206810 IP localhost.57551 > localhost.cbt: UDP, length 1048
19:02:42.206844 IP localhost.57551 > localhost.cbt: UDP, length 1048
19:02:42.206855 IP localhost.57551 > localhost.cbt: UDP, length 1048
19:02:42.206867 IP localhost.57551 > localhost.cbt: UDP, length 1048
19:02:42.206874 IP localhost.57551 > localhost.cbt: UDP, length 1048
19:02:42.206881 IP localhost.57551 > localhost.cbt: UDP, length 1048
19:02:42.206887 IP localhost.57551 > localhost.cbt: UDP, length 1048
19:02:42.206896 IP localhost.57551 > localhost.cbt: UDP, length 1048
19:02:42.206902 IP localhost.57551 > localhost.cbt: UDP, length 1048
19:02:42.206908 IP localhost.57551 > localhost.cbt: UDP, length 1048
19:02:42.206914 IP localhost.57551 > localhost.cbt: UDP, length 1048
19:02:42.206920 IP localhost.57551 > localhost.cbt: UDP, length 1048
19:02:42.206927 IP localhost.57551 > localhost.cbt: UDP, length 1048
19:02:42.272400 IP localhost.57551 > localhost.cbt: UDP, length 1048
19:02:42.272433 IP localhost.57551 > localhost.cbt: UDP, length 1048
19:02:42.272441 IP localhost.57551 > localhost.cbt: UDP, length 1048
19:02:42.272452 IP localhost.57551 > localhost.cbt: UDP, length 1048
19:02:42.272461 IP localhost.57551 > localhost.cbt: UDP, length 1048
19:02:42.272469 IP localhost.57551 > localhost.cbt: UDP, length 1048
19:02:42.272475 IP localhost.57551 > localhost.cbt: UDP, length 1048
19:02:42.272481 IP localhost.57551 > localhost.cbt: UDP, length 1048
19:02:42.272487 IP localhost.57551 > localhost.cbt: UDP, length 1048
19:02:42.272492 IP localhost.57551 > localhost.cbt: UDP, length 1048
19:02:42.272498 IP localhost.57551 > localhost.cbt: UDP, length 1048
19:02:42.272503 IP localhost.57551 > localhost.cbt: UDP, length 1048
19:02:42.272509 IP localhost.57551 > localhost.cbt: UDP, length 1048
19:02:42.332958 IP localhost.57551 > localhost.cbt: UDP, length 1048
19:02:42.333002 IP localhost.57551 > localhost.cbt: UDP, length 1048
19:02:42.333012 IP localhost.57551 > localhost.cbt: UDP, length 1048
19:02:42.333025 IP localhost.57551 > localhost.cbt: UDP, length 1048
19:02:42.333032 IP localhost.57551 > localhost.cbt: UDP, length 1048
19:02:42.333039 IP localhost.57551 > localhost.cbt: UDP, length 1048
19:02:42.333046 IP localhost.57551 > localhost.cbt: UDP, length 1048
19:02:42.333054 IP localhost.57551 > localhost.cbt: UDP, length 1048
19:02:42.391853 IP localhost.57551 > localhost.cbt: UDP, length 1048
19:02:42.391865 IP localhost.57551 > localhost.cbt: UDP, length 1048
19:02:42.391873 IP localhost.57551 > localhost.cbt: UDP, length 1048
19:02:42.391879 IP localhost.57551 > localhost.cbt: UDP, length 1048
19:02:42.391885 IP localhost.57551 > localhost.cbt: UDP, length 1048
19:02:42.391892 IP localhost.57551 > localhost.cbt: UDP, length 1048
19:02:42.391899 IP localhost.57551 > localhost.cbt: UDP, length 1048
19:02:42.391904 IP localhost.57551 > localhost.cbt: UDP, length 1048
19:02:42.391909 IP localhost.57551 > localhost.cbt: UDP, length 1048
19:02:42.391913 IP localhost.57551 > localhost.cbt: UDP, length 1048
19:02:42.391918 IP localhost.57551 > localhost.cbt: UDP, length 1048
19:02:42.391923 IP localhost.57551 > localhost.cbt: UDP, length 1048
19:02:42.391930 IP localhost.57551 > localhost.cbt: UDP, length 1048
19:02:42.391935 IP localhost.57551 > localhost.cbt: UDP, length 1048
19:02:42.450560 IP localhost.57551 > localhost.cbt: UDP, length 1048
19:02:42.450570 IP localhost.57551 > localhost.cbt: UDP, length 1048
19:02:42.450580 IP localhost.57551 > localhost.cbt: UDP, length 1048
19:02:42.450587 IP localhost.57551 > localhost.cbt: UDP, length 1048
19:02:42.450593 IP localhost.57551 > localhost.cbt: UDP, length 1048
19:02:42.450599 IP localhost.57551 > localhost.cbt: UDP, length 1048
19:02:42.450606 IP localhost.57551 > localhost.cbt: UDP, length 1048
19:02:42.450614 IP localhost.57551 > localhost.cbt: UDP, length 1048
19:02:42.450621 IP localhost.57551 > localhost.cbt: UDP, length 1048
19:02:42.450628 IP localhost.57551 > localhost.cbt: UDP, length 1048
19:02:42.509787 IP localhost.57551 > localhost.cbt: UDP, length 1048
19:02:42.509798 IP localhost.57551 > localhost.cbt: UDP, length 1048
19:02:42.509805 IP localhost.57551 > localhost.cbt: UDP, length 1048
19:02:42.509811 IP localhost.57551 > localhost.cbt: UDP, length 1048
19:02:42.509823 IP localhost.57551 > localhost.cbt: UDP, length 1048
19:02:42.509830 IP localhost.57551 > localhost.cbt: UDP, length 1048
19:02:42.509837 IP localhost.57551 > localhost.cbt: UDP, length 1048
19:02:42.509845 IP localhost.57551 > localhost.cbt: UDP, length 1048
19:02:42.509856 IP localhost.57551 > localhost.cbt: UDP, length 1048
19:02:42.509863 IP localhost.57551 > localhost.cbt: UDP, length 1048
19:02:42.509869 IP localhost.57551 > localhost.cbt: UDP, length 1048
19:02:42.509876 IP localhost.57551 > localhost.cbt: UDP, length 1048
19:02:42.509881 IP localhost.57551 > localhost.cbt: UDP, length 1048
19:02:42.509888 IP localhost.57551 > localhost.cbt: UDP, length 1048
19:02:42.509895 IP localhost.57551 > localhost.cbt: UDP, length 1048
19:02:42.509901 IP localhost.57551 > localhost.cbt: UDP, length 1048
19:02:42.509908 IP localhost.57551 > localhost.cbt: UDP, length 1048
19:02:42.509916 IP localhost.57551 > localhost.cbt: UDP, length 1048
19:02:42.565780 IP localhost.57551 > localhost.cbt: UDP, length 1048
19:02:42.565791 IP localhost.57551 > localhost.cbt: UDP, length 1048
19:02:42.565796 IP localhost.57551 > localhost.cbt: UDP, length 1048
19:02:42.565802 IP localhost.57551 > localhost.cbt: UDP, length 1048
19:02:42.565808 IP localhost.57551 > localhost.cbt: UDP, length 1048
19:02:42.565816 IP localhost.57551 > localhost.cbt: UDP, length 1048
19:02:42.565823 IP localhost.57551 > localhost.cbt: UDP, length 1048
19:02:42.565829 IP localhost.57551 > localhost.cbt: UDP, length 1048
19:02:42.622822 IP localhost.57551 > localhost.cbt: UDP, length 1048
19:02:42.622841 IP localhost.57551 > localhost.cbt: UDP, length 1048
19:02:42.622861 IP localhost.57551 > localhost.cbt: UDP, length 1048
19:02:42.622868 IP localhost.57551 > localhost.cbt: UDP, length 1048
19:02:42.622874 IP localhost.57551 > localhost.cbt: UDP, length 1048
19:02:42.622880 IP localhost.57551 > localhost.cbt: UDP, length 1048
19:02:42.622886 IP localhost.57551 > localhost.cbt: UDP, length 1048
19:02:42.622892 IP localhost.57551 > localhost.cbt: UDP, length 1048
19:02:42.622898 IP localhost.57551 > localhost.cbt: UDP, length 1048
19:02:42.622904 IP localhost.57551 > localhost.cbt: UDP, length 1048

